0,1
"ESRS S3-1 Non-respect of UNGPs on Business and Human Rights, ILO principles or OECD guidelines paragraph 17",Not material
ESRS S3-4 Human rights issues and incidents paragraph 36,Not material
ESRS S4-1 Policies related to consumers and end-users paragraph 16,Not material
ESRS S4-1 Non-respect of UNGPs on Business and Human Rights and OECD guidelines paragraph 17,Not material
ESRS S4-4 Human rights issues and incidents paragraph 35,Not material
ESRS G1-1 United Nations Convention against Corruption paragraph 10(b),Not material
ESRS G1-1 Protection of whistleblowers paragraph 10(d),Not material
ESRS G1-4 Fines for violation of anti-corruption and anti-bribery laws paragraph 24(a),"Targets and results, confirmed incidents of corruption or bribery"
ESRS G1-4 Standards to combat corruption and bribery paragraph 24(b),"Targets and results, confirmed incidents of corruption or bribery"
